Рюко;Кагами Цуруги;Лонгг;Квами Рюко -Лонгг;Рюко - Кагами Цуруги;Рюко(Кагами Цуруги) женского пола;Рюко - супергерой, под маской которого скрывается Кагами Цуруги. В эпизоде «Икари Годзэн» Ледибаг забирает у Мастера Фу Камень Дракона и Кагами, получив его, становится супергероем Рюко с супер силой преображения в стихии ветра, воды, молнии.;Рюко облачена в красный костюм с черными полосками, края которых золотистого цвета.;Рюко полностью повторяет характер Кагами Цуруги. Она - строгая и вдумчивая и японка, которая стремится выполнить любое взятое обязательство, кроме того она может быть довольно упрямой. Она не любит проигрывать из-за своего соревновательного характера, она преуменьшает свои расстроенные чувства и уважает своих соперников. Однако Кагами очень гостеприимный и целеустремлённый человек, который учится на своих ошибках. У Кагами также есть привычка делать поспешные выводы, она может быть довольно эмоциональной и склонной к ярости.;У Рюко(Кагами Цуруги) много друзей, например: Леди Баг, Супер Кот;Для Рюко(Кагами Цуруги) враги это: Бражник, Жертвы акумы;"Как и у остальных супергероев, Рюко обладает повышенной скоростью и ловкостью, и очевидно, как и остальные практически неуязвима. В качестве оружия обладает красной саблей,которую может использовать очень быстро (как и Рипост), и отражать удары настолько колоссальных противников как Икари Годзэн. 

Её особая сила является обращением в одну из трёх стихий: воздух (газ), вода и молния. Когда она использует силу воздуха, она обращается в газ и может вырваться из закрытого пространства или взлетать. 

Используя вторую силу — силу воды, Рюко обращается в неё, и может приводить в действие вещи восприимчивые к воде (например, мыльные шарики). 

Третья же сила — сила молнии, увы, не была показана, но можно предположить что с ней Кагами может превращаться в электрические потоки и наносить ними урон противникам.";Рюко на стороне добра;Рюко влюблена в Адриана Агреста.;Оружием Рюко является Меч. У меча есть красное лезвие, черная спиральная рукоять и крестовину украшает золотой поперечный щиток с заостренными кончиками. В центре сбоку на перекрестке находится круговой экран с тремя вращающимися иконками: облако, капля воды и молния. Любые значки могут быть заполнены цветными или цветными контурами. Клинок по-видимому меняет цвет в соответствии со значками на поперечине: желтый для молнии, серый для облака и синий для капли воды.;https://static.wikia.nocookie.net/ladybug/images/4/47/Ryuko_Square.png/revision/latest?cb=20191109023724&path-prefix=ru;";"
Супер Кот/Кот Нуар;Адриан Агрест;Плагг;Квами Супер Кота - Плагг;Супер Кот/Кот Нуар - Адриан Агрест;Супер Кот(Адриан Агрест) мужского пола;Супер Кот - супергерой, под маской которой скрывается Адриан Агрест, использует камень Кота Плагга.;На лице Супер Кота черная маска, а сам он одет в черным обтягивающий костюм.;Будучи Котом Нуаром, он даёт волю своей дикой сущности, становясь самоуверенным и общительным. Более оптимистичный и открытый Кот Нуар говорит все, что приходит ему на ум и много шутит насчет кошачьих каламбуров. Пытаясь привлечь внимание Ледибаг, он хвастается и выпендривается. Но его превращение в супергероя не убавляет его доброты и заботы о других, в том числе и верности. Несмотря на то, что он склонен к лени, Кот Нуар становится серьёзным, когда это необходимо. Например, когда он сражается со злодеями. Он пытается не показывать свою уязвимость со стороны Адриана, но она всё-таки проскальзывает время от времени.;У Супер Кот(Адриан Агрест) много друзей, например: Леди Баг, Карапас, Рена Руж, Рюкко, Король Обезьян, Квин Би;Для Супер Кот(Адриан Агрест) враги это: Бражник, Жертвы акумы;"В образе Кота Нуара он повысил навыки скорости, ловкости и силы. В эпизоде «Сирена» Кот Нуар смог убежать от пантер, скорость которых превышает человеческую.
Как и у любого кота у него обострённый слух, обоняние и ночное зрение.
В перемещении по городу использует элементы паркура. 

Его суперсила Катаклизм повреждает всё, к чему он прикасается своей рукой с кольцом. Но это тратит энергию и он трансформируется обратно через пять минут.";Супер Кот на стороне добра;Супер Кот влюблен в Леди Баг.;"Кот Нуар в качестве оружия использует жезл с хромированной поверхностью с зелёной светящейся кнопкой (похожа на лапу кота) на верхнем конце. Он выдвижной и когда Нуар его не использует, то жезл покоится на его пояснице. 

Он использует свой жезл, зная определенные навыки фехтования и изменению длины своего оружия. Кот Нуар может использовать его как меч, щит, посох или короткую палку. Он также может его метать. Для перемещения на большие расстояния он быстро вращает свой жезл, затем удлиняет его, отталкиваясь от земли и подлетая, а затем снова вращает его. Также с помощью него можно задерживать дыхание под водой. Без него он может передвигаться лапами или когтями, как в эпизоде «Разлучник» и сражаться в рукопашную.";https://i.pinimg.com/564x/0a/48/a1/0a48a12cd4b4ce8debe0df976bd6282e.jpg;";"
